<?xml version="1.0" encoding="UTF-8"?>
<tns:client xmlns:tns="http://www.wait.com/client" xmlns:xsi="http://www.w3.org/2001/XMLSchema-instance" xsi:schemaLocation="http://www.wait.com/client Client.xsd ">
  <tns:id>1</tns:id>
  <tns:name>Mark</tns:name>
  <tns:age>30</tns:age>
  <tns:dob>2001-01-01</tns:dob>
  <tns:email>m@m.pl</tns:email>
  <tns:gender>M</tns:gender>
  <tns:payment>
    <tns:cash>100</tns:cash>
  </tns:payment>
</tns:client>
